product_id,product_name,category_id,price,description,image_url,date_added
1,Thrubanower,8,22.83,"manifestum essit. Et quoque in et novum volcans non non pars e regit, quo novum quoque et quad Sed quo",http://utcrt.net72/aewwg/pnygx.aspx,2008-12-07 10:38:04.810
2,Doperex,9,62.27,"regit, gravum in plurissimum Longam, fecit, vobis eggredior. cognitio, manifestum si bono quo, quad travissimantor plurissimum Et plurissimum",http://pmc.web5/myrpc/pitvq/oya.php,1988-06-09 20:53:46.970
3,Hapvenor,8,39.85,"e et plorum glavans gravis gravis quo, plurissimum plorum Pro habitatio pars quorum vobis apparens manifestum",https://tgowd.netu2/nbhoj/prnuj/eek.html,1987-09-29 11:13:45.270
4,Barnipedgar,6,33.63,"delerium. apparens plorum quad vantis. quad linguens non plorum Versus manifestum delerium. glavans homo,",http://code.localc7/hgkti/olaob/ctyxq/yfzty/zhihu.htm,2021-11-11 12:43:17.200
5,Emdimicator,3,21.12,"in estis nomen Et linguens quo fecundio, Quad volcans plorum non linguens Pro gravis travissimantor fecundio, fecit.",https://pcfnz.web/azanb/vply.aspx,1992-08-06 19:46:50.620
6,Lomhupistor,6,92.41,quorum delerium. ut transit. vobis travissimantor parte delerium. quartu nomen travissimantor non fecit. e,https://oiht.web65/mzokx/wckk.php,1991-09-10 20:51:33.320
7,Froquestefax,10,87.16,"Longam, plurissimum quad et bono imaginator cognitio, in et quo pars estis glavans non pars homo, habitatio",https://mgwmf.web75/rkuxo/ldcab/krz.html,1968-03-24 18:46:34.120
8,Qwieronor,5,40.29,"dolorum Tam venit. estis quo venit. estis ut brevens, rarendum vantis. cognitio, estis ut quo, trepicandor",https://evkf.web84/qrlxf/bcfvk/uzlfz.html,2017-01-13 05:43:42.600
9,Lomhupax,10,72.33,"egreddior funem. regit, nomen venit. linguens et quantare ut Versus sed homo, quoque Pro quoque esset",https://rnkjv.locald77/bliqa/myaoo/ppf.aspx,1959-07-05 15:19:24.540
10,Empebex,3,58.64,"estis fecit. Id quad gravum quantare cognitio, vantis. vantis. quad et delerium. Pro plurissimum travissimantor brevens,",https://txnkd.webc7/kcwjt/cpzx.html,2001-11-17 10:20:13.680
11,Thrufropedentor,3,33.29,esset novum pars vobis e parte Tam Multum estum. pladior quad et gravis dolorum quo fecit. vobis e trepicandor,http://zvo.webh46/jqibn/uta.aspx,1991-01-31 15:57:57.950
12,Dopbanupin,5,71.55,"si gravum quis Multum non Multum homo, Et eggredior. parte eudis delerium. quantare gravis volcans pladior non fecit, Id regit,",http://yfwq.locald/tdmnv/lpqtd.html,1956-11-21 15:10:40.380
13,Varnipin,7,59.88,"Pro plorum Multum et brevens, cognitio, Longam, plorum quartu Longam, quo in regit, fecit. quantare cognitio,",https://gbbbc.webs/airpl/dtzxe/zcphk/kisgt.htm,1999-08-28 03:22:31.680
14,Thrukilentor,5,51.79,"bono non et e et transit. estum. esset estis regit, estum. Multum et trepicandor non nomen dolorum vobis",https://bto.webh88/afeal/fcnbz.htm,1958-03-30 14:43:48.340
15,Supwerupantor,10,62.82,"gravis Quad funem. homo, cognitio, imaginator nomen vobis linguens quartu cognitio, Multum in funem.",http://kla.local2/mjfqw/lcg.aspx,2004-06-05 11:14:44.390
16,Varvenedgan,1,92.35,"plorum Id essit. delerium. eggredior. plorum Id linguens sed venit. fecundio, gravum et pladior eudis",https://cfig.web18/orpwc/bhmcs/qgjif/zssmg/fsroa.html,2009-07-14 13:02:42.270
17,Frodimar,9,2.86,gravis et e novum plurissimum trepicandor et travissimantor et gravis quartu sed essit. et funem. in,https://jcqz.web11/hkmsa/gbcxj/ckirk/ngljc.htm,1972-11-15 02:13:37.490
18,Pardudefax,10,61.78,"et venit. brevens, venit. imaginator linguens in e fecundio, Multum quartu quad novum quoque plorum quo",NULL,1986-08-26 09:10:51.620
19,Winbanistor,7,20.65,"pars si pladior non dolorum quis apparens vantis. non sed brevens, et eudis regit, volcans travissimantor Versus fecit, quoque parte ut",https://kbgt.local49/aqsuy/szoo.php,1972-11-11 07:39:49.750
20,Tupmunamower,4,47.71,"pars quis fecit, pars non travissimantor rarendum gravis habitatio e Et vobis et Versus non plorum Sed pars e venit. essit. quo",https://yvrfp.locald34/ibwhr/kykrv/mrkjz/wcyva/aua.php,1997-12-21 05:17:30.860
21,Haptumonan,9,34.10,"Quad quad plorum Sed quo, Tam homo, delerium. eudis in transit. quis funem. Pro gravis vantis. quo, Quad",https://hgp.webq28/jodwt/gyueh/bxnba/wkvko/owjj.php,2005-01-15 06:03:18.010
22,Tuptumadazz,9,4.32,"habitatio estum. cognitio, esset Id volcans travissimantor travissimantor quad non Tam quad trepicandor fecit. et quo pladior plorum fecundio, quorum",http://fso.netw/ururz/ogvpd/zssza/iwt.aspx,2007-08-23 05:42:44.060
23,Klijubar,10,62.50,"fecundio, quorum apparens eggredior. venit. sed eggredior. cognitio, brevens, bono plorum eggredior. quartu et e",http://kcwm.webe01/pwkwi/necuf/wpgcr.htm,1962-02-07 04:25:19.110
24,Rapsipicazz,1,54.56,"estum. Tam pars linguens regit, plorum plurissimum gravum quo apparens parte fecit. quad et esset estis nomen",https://mfg.local95/yucoj/jloqj/mqxwq/zbj.php,1994-10-27 22:47:13.850
25,Surkilentor,7,71.26,estum. ut funem. venit. Id nomen gravis habitatio si in gravis estis vobis fecit. et travissimantor delerium. rarendum estum. Pro,http://rkp.neth97/kxhgc/fwh.php,1953-04-06 08:38:45.500
26,Klidudentor,6,69.77,NULL,http://qzz.netp72/wzovk/lkgmt/yjlw.htm,1997-04-25 19:25:48.530
27,Tipmunommax,10,31.88,glavans eudis gravis pladior volcans fecit. delerium. vobis bono funem. quartu gravum novum eudis imaginator Pro,http://agf.net0/jkfow/lhnx.aspx,2016-04-11 02:45:15.560
28,Monzapower,7,50.85,"brevens, homo, quo, Et plorum Id gravis manifestum quo gravis ut pars eggredior. fecit, novum vantis. transit. si in",https://dfg.localb77/nncqi/hjjma/hfqix/jkiee/akcba.aspx,1978-09-23 14:29:02.350
29,Inbanazz,6,6.90,"glavans in estum. Longam, Id quo, gravis et fecundio, transit. quartu egreddior gravum quo pladior bono",http://kob.net/qlfjd/yrws.html,2016-01-25 17:54:46.070
30,Embanar,1,87.49,"quo si imaginator Id in pladior fecit, plorum quorum imaginator Et pars eggredior. trepicandor pladior Et quo, in",https://piij.local/jogil/dhvdf/twzv.aspx,1973-07-27 10:49:20.080
31,Parzapewax,2,37.70,"nomen Tam quad dolorum fecit. quis quo, habitatio Longam, habitatio habitatio novum non e brevens, quo vobis gravum et et",https://kfhs.netv79/ajlbr/uxgoo/ajx.aspx,1986-12-14 08:34:09.830
32,Tuptanedentor,5,70.37,"quo Longam, et travissimantor essit. trepicandor dolorum quantare dolorum brevens, Versus non vantis.",http://oayn.web86/lkhiz/ciuis/tewqk/gkzvk/nfnf.htm,1987-11-09 13:26:40.710
33,Kliwerpefax,3,6.28,"fecundio, vobis Pro sed plorum rarendum fecit. Id essit. estis pars e si apparens quo plurissimum linguens Multum",http://muh.localh0/nqavu/ihiqd/pqqzv/tsxwu/glmk.php,1971-06-12 20:18:33.990
34,Froglibedgover,10,41.43,"linguens ut delerium. non quo, et plorum quoque vobis esset apparens fecit, et trepicandor eudis in delerium. trepicandor quad",http://rcq.netk7/xdjsb/rdemt/mxrvn/jsxoz/lhz.html,1987-05-03 08:20:05.240
35,Thruhupantor,7,81.00,"et cognitio, Versus plorum et glavans brevens, non essit. quartu pars gravum vobis eggredior. Quad fecit.",http://ectn.local8/ugowc/qsviw/ihhje/gufor/hroz.aspx,2013-09-29 07:28:53.810
36,Doptumilax,8,65.28,"si esset rarendum manifestum vobis essit. in nomen non fecit, apparens apparens vobis non Pro novum eudis linguens",https://skdy.localc/ghdsd/lfqnw/kafpz/lwruw/erf.htm,2008-04-28 17:24:01.130
37,Rekiledgex,1,97.51,plorum Multum venit. quantare Tam quartu glavans estis quis travissimantor travissimantor si habitatio,https://cwecz.web/cthko/zdscb/gfamk/olpcq/lzkhb.aspx,1985-08-25 20:48:50.400
38,Grodimin,4,14.37,"nomen Sed Versus regit, quad Multum manifestum fecundio, delerium. et esset in Versus Multum si rarendum",http://kotym.neta0/hoqyc/whish/caz.php,1965-10-01 14:24:22.510
39,Haprobex,4,58.50,"Quad fecundio, non Tam apparens ut parte novum habitatio et Multum et e glavans linguens in volcans si Versus esset",https://bta.locals0/xnunl/awjlf/cuvrg/vlmth/axm.htm,1959-09-19 02:36:57.410
40,Tupzapexantor,10,52.64,"glavans et quad quad pars estum. quad travissimantor trepicandor pars bono non et cognitio, trepicandor si si eggredior. non",http://mam.localu/aacgh/mqgc.htm,1968-12-21 22:04:56.260
41,Lomtanopan,6,5.90,"parte quis transit. quartu plurissimum bono volcans Quad quo venit. et estis linguens homo, egreddior quo, plurissimum",http://gol.webv5/klzfc/katlg/lkn.html,1978-01-13 07:23:10.100
42,Endbanommar,8,53.73,"linguens et quorum nomen non non sed plurissimum egreddior eudis parte funem. quad quo regit, glavans gravis funem.",http://gggb.net/gpciy/ksuh.htm,1978-12-30 05:53:20.810
43,Surpickackin,2,59.59,"linguens novum non nomen non manifestum brevens, imaginator quo, apparens quis si plorum fecit. rarendum",http://wcqa.netc61/ijjiz/mftdl/dhlbs/sed.aspx,1974-11-20 22:10:05.540
44,Parmuninax,3,37.91,"eudis gravum delerium. quartu fecit. egreddior non fecundio, plorum Id Id quo regit, Multum imaginator novum",http://kmihu.net7/aajvd/essrz/eabjx/evoz.html,2003-07-28 21:13:24.850
45,Tupfropewentor,10,27.54,quad si vobis dolorum quad bono in egreddior eggredior. plurissimum quad e quad trepicandor egreddior,https://veki.nety/aixpj/brnlp/gtasx.php,2013-05-02 01:24:04.210
46,Lomcadopistor,8,98.75,"egreddior et novum estum. Et fecit, glavans delerium. quo, brevens, quartu si Multum esset si manifestum quartu quoque Longam, fecit, novum",https://bwkih.net2/coqba/xuwmi/nxry.php,1997-09-02 15:31:15.120
47,Tiperinazz,4,13.98,quo eggredior. rarendum Multum imaginator quad non eudis glavans quis plorum linguens Pro funem. in quad,http://ejg.nete/terly/mpqsa/aur.php,1963-10-11 20:07:35.040
48,Dopwerilicator,5,59.21,"quartu essit. nomen cognitio, in funem. Quad funem. si apparens glavans venit. volcans Et Pro estum. et",https://xlqrc.webl/gwclq/ruwsd.htm,1998-01-30 01:33:25.880
49,Rapjubower,2,52.15,"essit. imaginator dolorum plorum brevens, Versus cognitio, homo, vobis travissimantor imaginator imaginator",http://zhcdo.net9/rbcpb/rqpj.aspx,2010-06-27 10:18:32.840
50,Tuperamazz,3,30.77,"quad quo, et linguens Longam, egreddior gravis brevens, Id regit, fecit. volcans quorum delerium. et",https://jsawv.net53/hhdhb/xdhzz/evglu/ydkvu/nbv.htm,2002-07-02 04:02:53.340
51,Endmunax,5,69.70,"esset vobis fecit, imaginator et eggredior. apparens imaginator linguens si imaginator nomen e ut plurissimum homo,",http://cryvu.web57/zktlr/fifbl.aspx,1956-01-07 20:52:37.590
52,Supvenaquistor,8,11.43,"et quorum in nomen quo, transit. pars bono essit. Multum et si et Id quad esset Versus Tam plorum Id Multum",http://nhuz.localx83/bbxmy/gqwjc/kuhwx.html,1985-06-24 09:16:58.960
53,Thrutinewan,7,20.75,"et in apparens travissimantor pladior glavans estum. quorum quad egreddior non novum estis brevens, in fecit, linguens",http://khr.web9/uokui/ektdg/tpder/adbg.aspx,1979-12-19 10:31:58.830
54,Endnipar,5,33.85,"quo, glavans fecit. Multum linguens in quantare gravis pladior linguens homo, bono rarendum quad vobis",http://ytj.net2/bvshb/cld.aspx,2019-12-15 02:36:00.310
55,Dopjubupicator,2,86.73,"quad nomen cognitio, si homo, nomen quo, vantis. non cognitio, nomen et nomen plorum quantare quo in",https://qsncw.local85/ckgut/tzzao/mjof.html,1986-02-17 11:24:45.700
56,Indudex,9,19.50,"et essit. et quo, in funem. estum. quad pars vobis delerium. quartu et plorum fecundio, quoque delerium. et regit,",https://xcmha.local43/nbjfr/ishea/qdfpm/rhfl.aspx,1954-04-18 04:55:20.750
57,Monfroponentor,9,99.78,"linguens plorum et e essit. essit. delerium. brevens, Longam, estis plorum fecit, et e et plurissimum non",http://cfye.localq0/cexrt/vscfq/qzocr/tbfep/ijnn.aspx,1979-05-04 16:28:27.860
58,Surfropicazz,8,85.29,"nomen quad nomen et quorum in quad quad quo, non parte quartu linguens pars travissimantor quo linguens et quo quad Quad",http://pcy.netm53/cklih/geyji/byp.htm,2016-12-01 12:26:31.420
59,Upsapefin,9,62.38,"Versus et vantis. novum plurissimum Sed estis egreddior nomen plorum manifestum regit, estis glavans dolorum",http://jius.netu/qrpkl/bfcab/gtlih/xptdr.html,2021-08-08 04:04:31.690
60,Emerollover,7,51.36,"in Quad et Versus quad egreddior e e si e quis Longam, bono Id rarendum fecit. nomen novum dolorum eudis",https://jjwkn.net/txnyw/ghhbb/heurv.aspx,2019-04-13 00:21:02.090
61,Rehupadazz,7,61.52,"homo, gravis delerium. fecit, estum. plurissimum vobis in quartu parte gravum non Longam, e vobis vobis rarendum sed brevens, Quad",https://zlld.local65/hfdpj/ysjwj/xgi.html,1999-05-31 18:06:17.760
62,Supzapar,3,37.31,"quo plorum Sed apparens et vantis. vobis in eudis manifestum essit. estum. quorum Longam, linguens gravis quad et",https://vtxm.webi3/bouum/vdpkc/eeqpo/xkppb/uru.html,2013-07-01 04:17:31.780
63,Endquesticex,9,34.38,"quad esset ut non Multum quartu nomen et regit, et quartu quad estum. essit. non essit. bono Pro gravis habitatio",https://xfrnh.web44/dfsvt/lstxm/pln.html,1953-12-20 11:48:56.520
64,Surkilover,9,84.84,"gravis gravis gravis pars fecit, estum. e non gravis Longam, quantare novum egreddior Sed si novum quo",http://zri.webx68/mekxr/vzyyl/dmatw/vum.html,2009-12-08 04:30:04.460
65,Barpickazz,1,21.94,"si e manifestum bono fecit, in travissimantor et nomen quorum novum nomen Pro si delerium. estum. linguens et quoque",https://vqvs.local41/tbyyz/dbxny/vmdjr.html,1967-12-06 01:46:03.840
66,Cippebistor,9,62.93,non Et travissimantor pladior venit. Quad si quartu linguens apparens volcans vobis Quad non quis quad,NULL,1956-03-25 02:31:17.240
67,Zeetanover,2,66.26,"quantare gravis manifestum gravum in linguens et Tam plorum Versus transit. fecit, Et dolorum nomen linguens venit. estum. novum",https://kpyb.web13/plfhr/awc.htm,2009-06-10 18:52:06.400
68,Varzapommex,7,19.45,"et ut rarendum pars Tam et Versus quo, quad in cognitio, plorum Longam, plurissimum quo, imaginator si",https://yxlz.web44/wddwx/pzsco/tqel.htm,1965-04-27 19:02:26.440
69,Doptinan,9,70.80,"si brevens, plorum si plorum non rarendum et non fecundio, gravum non pladior quo, bono non et habitatio",https://kekyz.web/djozh/dobdn.php,1968-06-30 07:14:54.530
70,Untanar,3,97.55,"plorum in delerium. Pro vantis. brevens, regit, venit. gravum trepicandor estis funem. Longam, funem.",http://okori.webv/zmfds/qtnps/jmiaw/nqxu.html,2020-02-06 17:50:43.270
71,Surmunentor,10,94.85,"et quo, novum si travissimantor cognitio, habitatio parte gravis imaginator esset vantis. e novum quo,",http://pyjt.webp72/ljwxt/svk.html,1976-11-19 16:13:51.860
72,Upvenewex,5,88.49,"et volcans travissimantor regit, Quad e essit. dolorum novum vobis et quartu Versus fecit. fecit. et",NULL,1960-02-15 11:49:14.980
73,Zeefropimicator,7,4.28,"quo delerium. quo plorum et non cognitio, eggredior. imaginator Id plorum plorum delerium. et si gravis manifestum esset",http://bilgq.webi/ihzgg/rofmc/zrsd.aspx,1979-12-09 06:33:54.210
74,Zeepickin,8,68.02,non et Quad esset parte Tam ut plurissimum apparens rarendum nomen apparens estum. bono Versus venit.,http://ejui.local/mbncx/nquql/tqynz/lpx.html,1956-11-21 09:34:53.490
75,Bartinepentor,9,42.81,"fecit. linguens Id non quorum Longam, linguens quad quantare quorum regit, gravis brevens, eggredior.",http://ijt.net34/cdzzn/dcj.html,1972-12-08 21:54:20.760
76,Upglibepentor,2,80.37,"et quad fecit, fecit, Quad Sed quorum et et Quad quo glavans in gravis quo Longam, rarendum trepicandor",http://lsv.local/uhtqu/mzrmh/ysovo/krmuv.html,1979-01-18 00:09:57.200
77,Supkilommazz,8,44.74,"dolorum plorum esset vobis pladior quad glavans habitatio vobis non trepicandor bono gravis apparens venit. regit,",https://ybsd.netz28/ezhdk/zzwse/gspth/lqt.htm,1985-10-03 07:32:38.510
78,Surpickicower,8,25.59,"in fecit. gravis gravis plorum et quis quo si manifestum brevens, vobis estum. venit. eggredior. dolorum quad gravum",https://goyx.web7/vkkij/dxrfw/wvtgt/jtpwj.aspx,1982-07-12 07:11:54.260
79,Truvenexistor,2,28.02,"linguens cognitio, Longam, e e pars funem. regit, et trepicandor eggredior. pars pars pars quo, imaginator fecit. et",https://yby.locall0/iyqnn/qko.php,2005-06-26 21:23:09.650
80,Zeedudan,10,72.52,"novum et regit, parte non imaginator quo rarendum gravis ut plorum e gravis non pladior vobis vobis fecit.",https://duehj.net/lnzbz/akdvy/xupwg/gzhid/xdt.aspx,1979-08-03 17:07:30.390
81,Doptinanor,2,56.79,"quad fecundio, Multum gravum Quad imaginator quantare eggredior. essit. delerium. non fecit. homo, transit. sed imaginator et",http://kye.local54/jekxe/wksm.htm,1986-07-16 23:18:13.490
82,Kliweran,5,72.68,"glavans estum. estum. sed Multum fecundio, travissimantor Sed quo gravum brevens, Id quorum travissimantor quoque",https://bgd.netd/hfkak/hniuy.htm,1971-03-14 01:11:49.680
83,Tuptinanex,6,98.71,"Multum estum. e sed estis volcans dolorum quad Tam funem. rarendum homo, Quad Sed quorum Multum e Versus Id",https://ygsig.netp5/pjrkh/ygwem/fucee/xjlcf/lvppx.php,1992-03-28 04:10:29.510
84,Supdimaquex,4,76.14,"quartu e Id estis in brevens, quad fecit. cognitio, et apparens quad plorum vobis volcans plurissimum",https://ugn.local/kjgtu/dmgal/rws.htm,1966-07-27 13:51:52.730
85,Thrukilanistor,7,18.78,"e quo quad plorum e pars fecit, fecit. rarendum plorum et Sed quad pars non quoque non linguens regit,",http://zmkj.netn3/fjfcx/cvl.htm,1970-07-21 13:56:42.490
86,Monquestonex,5,27.26,"gravis quad pars plorum fecit. manifestum vantis. novum nomen Versus non fecundio, si pars vobis non Quad",https://ciw.web85/izapb/cfeef/brfvt/prtcc/iam.aspx,1954-06-22 23:17:10.870
87,Winrobentor,9,50.62,"Tam brevens, quo e vobis quartu quo et Sed e gravis Pro Sed gravis eggredior. travissimantor vobis et e quo quad delerium. ut",https://mjfn.webb9/fgsmv/faxmz/jzfwf/amdmu/van.php,1960-11-22 02:54:41.870
88,Supdimex,9,72.44,"et volcans in et cognitio, plorum esset fecundio, plorum et brevens, vantis. quad nomen si gravis sed trepicandor et",https://kzn.local/mthyw/mlwov/wbxpq/lar.aspx,1975-06-28 17:42:33.680
89,Kliglibicower,8,54.70,"si Longam, quo manifestum quoque nomen Pro glavans esset Pro gravis habitatio quo, bono non e quoque cognitio,",https://bdba.netl5/gfepw/kezvp.aspx,1954-03-16 20:55:19.530
90,Inglibegax,8,62.49,"ut transit. sed vobis quorum plorum in manifestum fecit, volcans non gravis dolorum esset egreddior nomen",http://yhtlj.net78/mzkcm/ygrkl/pvhru.php,2012-06-14 02:33:33.050
91,Grosipex,10,65.50,"linguens eggredior. dolorum in venit. si Pro gravis delerium. plorum rarendum Tam quad fecit, quad si",http://symer.localg24/askuw/szbko/pvnjz/zlndn.php,1981-12-27 00:55:33.260
92,Emsipazz,3,13.22,essit. si Versus egreddior vobis dolorum quad non nomen egreddior pars Id plorum gravum travissimantor pars venit.,http://osrc.net25/wxktg/oyicc/xeamw/wexol/zhz.aspx,1992-09-23 08:22:18.990
93,Tupwerax,6,52.00,"quorum brevens, brevens, et dolorum non novum gravis novum linguens sed delerium. esset venit. manifestum cognitio, in fecundio,",https://jgk.neti7/zowim/uxklg/syzil/tyrp.htm,1968-02-23 10:19:50.820
94,Lomeredan,7,8.14,"quad venit. non quis manifestum estum. parte Multum quad plorum parte trepicandor et pars nomen brevens,",https://vfk.web/kfird/wnbod/lommu/zziuk/hpqxj.aspx,1964-06-07 02:15:55.320
95,Inbanar,4,91.12,"quo, Longam, manifestum quo gravis quo bono e glavans linguens Et trepicandor Tam trepicandor manifestum",https://cuhs.net28/afdhh/yiuxf/pvdkn/ydg.aspx,1993-07-23 03:58:38.500
96,Dopweristor,3,68.59,transit. quartu et non pars estis quoque habitatio quoque estum. quad gravum travissimantor gravis dolorum,https://rguv.web/fjadi/flnys/arwnf/pxiie/upay.html,1988-07-14 03:05:38.320
97,Enddimefax,9,20.35,"brevens, plorum quad novum parte quis quartu gravis venit. ut vobis quartu quartu plurissimum egreddior fecit. et",http://ecxkl.webf7/xwmro/iytdf/wejj.php,1978-01-10 18:04:24.290
98,Qwifroponazz,3,74.75,"plorum in quo nomen gravum apparens novum quis plorum in dolorum plorum et et estis non quartu quo, gravis",http://jjrnu.webl9/dqphu/ylbuf/awio.htm,1988-12-12 17:40:01.080
99,Suprobador,2,16.96,"transit. pars quoque plurissimum non parte plurissimum quartu eudis plorum sed fecit, et eggredior. quo, rarendum rarendum vobis",https://mam.webf6/myaex/ygxpb/wfo.html,1988-08-23 19:27:21.010
100,Adtanexantor,1,64.62,"funem. egreddior fecundio, pladior Longam, Pro travissimantor essit. plorum esset volcans venit. Longam, Longam,",http://xusd.netd63/lqjdp/fhdvk/jevrd/thawt/pii.aspx,2010-02-07 22:52:46.970
